{
    "state": {
        "inventory": {
            "slots": [
                {
                    "item": "iron_pickaxe",
                    "count": 1
                },
                {
                    "item": "wall",
                    "count": 0
                },
                {
                    "item": "diamond",
                    "count": 0
                },
                {
                    "item": "tree_tap",
                    "count": 0
                },
                {
                    "item": "pogo_stick",
                    "count": 0
                },
                {
                    "item": "block_of_diamond",
                    "count": 0
                },
                {
                    "item": "oak_log",
                    "count": 0
                },
                {
                    "item": "diamond_ore",
                    "count": 0
                },
                {
                    "item": "stick",
                    "count": 0
                },
                {
                    "item": "oak_plank",
                    "count": 0
                },
                {
                    "item": "door",
                    "count": 0
                },
                {
                    "item": "sapling",
                    "count": 0
                },
                {
                    "item": "minecraft_fence",
                    "count": 0
                },
                {
                    "item": "log",
                    "count": 0
                },
                {
                    "item": "key",
                    "count": 0
                },
                {
                    "item": "open_door",
                    "count": 0
                },
                {
                    "item": "crafting_table",
                    "count": 0
                },
                {
                    "item": "safe",
                    "count": 0
                },
                {
                    "item": "plank",
                    "count": 0
                },
                {
                    "item": "rubber",
                    "count": 0
                },
                {
                    "item": "block_of_platinum",
                    "count": 0
                },
                {
                    "item": "air",
                    "count": 0
                },
                {
                    "item": "chest",
                    "count": 0
                },
                {
                    "item": "block_of_titanium",
                    "count": 0
                }
            ],
            "selectedItem": "air"
        },
        "player": {
            "pos": [
                62,46
            ],
            "facing": "east"
        },
        "map": {
            "61,40": "wall",
            "60,71": "wall",
            "54,71": "wall",
            "78,40": "wall",
            "77,71": "wall",
            "55,40": "wall",
            "48,64": "wall",
            "48,65": "wall",
            "48,62": "wall",
            "48,63": "wall",
            "48,60": "wall",
            "48,61": "wall",
            "61,49": "minecraft_fence",
            "61,48": "minecraft_fence",
            "61,47": "minecraft_fence",
            "61,46": "minecraft_fence",
            "48,68": "wall",
            "61,45": "minecraft_fence",
            "48,69": "wall",
            "48,66": "wall",
            "48,67": "wall",
            "55,58": "minecraft_fence",
            "50,40": "wall",
            "55,57": "minecraft_fence",
            "55,56": "minecraft_fence",
            "77,68": "diamond_ore",
            "77,69": "diamond_ore",
            "48,53": "wall",
            "48,54": "wall",
            "48,51": "wall",
            "48,52": "wall",
            "55,59": "minecraft_fence",
            "48,50": "wall",
            "61,59": "minecraft_fence",
            "48,59": "wall",
            "61,58": "minecraft_fence",
            "61,57": "minecraft_fence",
            "48,57": "wall",
            "61,56": "minecraft_fence",
            "48,58": "wall",
            "48,55": "wall",
            "48,56": "wall",
            "67,49": "minecraft_fence",
            "61,60": "minecraft_fence",
            "55,60": "minecraft_fence",
            "48,42": "wall",
            "48,43": "wall",
            "50,57": "minecraft_fence",
            "48,40": "wall",
            "73,40": "wall",
            "50,56": "minecraft_fence",
            "48,41": "wall",
            "50,59": "minecraft_fence",
            "66,71": "wall",
            "67,40": "wall",
            "50,58": "minecraft_fence",
            "72,71": "wall",
            "48,48": "wall",
            "48,49": "wall",
            "48,46": "wall",
            "67,48": "minecraft_fence",
            "48,47": "wall",
            "48,44": "wall",
            "48,45": "wall",
            "62,45": "air",
            "62,46": "minecraft_fence",
            "62,47": "oak_log",
            "56,40": "wall",
            "62,48": "minecraft_fence",
            "61,71": "wall",
            "62,49": "minecraft_fence",
            "55,71": "wall",
            "50,60": "minecraft_fence",
            "67,50": "minecraft_fence",
            "67,51": "minecraft_fence",
            "67,52": "minecraft_fence",
            "62,40": "wall",
            "62,56": "minecraft_fence",
            "62,57": "minecraft_fence",
            "62,58": "minecraft_fence",
            "62,59": "minecraft_fence",
            "79,50": "wall",
            "79,52": "wall",
            "79,51": "wall",
            "79,54": "wall",
            "56,56": "minecraft_fence",
            "79,53": "wall",
            "56,57": "minecraft_fence",
            "79,56": "wall",
            "50,71": "wall",
            "56,58": "minecraft_fence",
            "79,55": "wall",
            "56,59": "minecraft_fence",
            "79,58": "wall",
            "79,57": "wall",
            "51,40": "wall",
            "73,66": "pogoist_102",
            "79,59": "wall",
            "56,60": "minecraft_fence",
            "78,71": "wall",
            "79,41": "wall",
            "79,40": "wall",
            "79,43": "wall",
            "79,42": "wall",
            "79,45": "wall",
            "79,44": "wall",
            "79,47": "wall",
            "79,46": "wall",
            "79,49": "wall",
            "79,48": "wall",
            "51,56": "minecraft_fence",
            "51,58": "oak_log",
            "51,57": "minecraft_fence",
            "73,71": "wall",
            "74,40": "wall",
            "51,59": "minecraft_fence",
            "68,40": "wall",
            "67,71": "wall",
            "62,60": "minecraft_fence",
            "68,49": "minecraft_fence",
            "68,48": "minecraft_fence",
            "63,45": "minecraft_fence",
            "63,46": "minecraft_fence",
            "56,71": "wall",
            "63,47": "minecraft_fence",
            "79,70": "wall",
            "57,40": "wall",
            "63,48": "minecraft_fence",
            "63,49": "minecraft_fence",
            "79,71": "wall",
            "51,60": "minecraft_fence",
            "51,62": "trader_104",
            "51,64": "self",
            "68,52": "minecraft_fence",
            "68,51": "minecraft_fence",
            "68,50": "minecraft_fence",
            "62,71": "wall",
            "63,40": "wall",
            "63,56": "minecraft_fence",
            "63,57": "minecraft_fence",
            "63,58": "oak_log",
            "63,59": "minecraft_fence",
            "79,61": "wall",
            "79,60": "wall",
            "79,63": "wall",
            "79,62": "wall",
            "79,65": "wall",
            "57,57": "minecraft_fence",
            "57,58": "oak_log",
            "52,40": "wall",
            "79,64": "wall",
            "79,67": "wall",
            "57,59": "minecraft_fence",
            "79,66": "wall",
            "51,71": "wall",
            "79,69": "wall",
            "79,68": "wall",
            "57,56": "minecraft_fence",
            "57,60": "minecraft_fence",
            "52,58": "minecraft_fence",
            "52,59": "minecraft_fence",
            "52,56": "minecraft_fence",
            "52,57": "minecraft_fence",
            "75,40": "wall",
            "74,71": "wall",
            "69,40": "wall",
            "68,71": "door",
            "63,60": "minecraft_fence",
            "69,49": "minecraft_fence",
            "69,48": "minecraft_fence",
            "64,47": "minecraft_fence",
            "57,71": "door",
            "64,46": "minecraft_fence",
            "58,40": "wall",
            "64,49": "minecraft_fence",
            "64,48": "minecraft_fence",
            "70,49": "minecraft_fence",
            "70,48": "minecraft_fence",
            "52,60": "minecraft_fence",
            "70,40": "wall",
            "69,52": "minecraft_fence",
            "69,51": "minecraft_fence",
            "69,50": "oak_log",
            "63,71": "wall",
            "64,40": "wall",
            "64,45": "minecraft_fence",
            "64,58": "minecraft_fence",
            "64,57": "minecraft_fence",
            "64,59": "minecraft_fence",
            "53,40": "wall",
            "58,58": "minecraft_fence",
            "58,59": "minecraft_fence",
            "76,40": "wall",
            "70,56": "chest",
            "52,71": "wall",
            "70,52": "minecraft_fence",
            "58,56": "minecraft_fence",
            "58,57": "minecraft_fence",
            "70,51": "minecraft_fence",
            "70,50": "minecraft_fence",
            "64,56": "minecraft_fence",
            "58,60": "minecraft_fence",
            "53,56": "minecraft_fence",
            "53,59": "minecraft_fence",
            "69,71": "wall",
            "53,57": "minecraft_fence",
            "53,58": "minecraft_fence",
            "75,71": "wall",
            "64,60": "minecraft_fence",
            "59,40": "wall",
            "76,60": "block_of_platinum",
            "58,71": "wall",
            "53,60": "minecraft_fence",
            "71,49": "minecraft_fence",
            "71,48": "minecraft_fence",
            "76,68": "diamond_ore",
            "76,69": "diamond_ore",
            "70,71": "wall",
            "71,40": "wall",
            "49,71": "wall",
            "65,40": "wall",
            "64,71": "wall",
            "65,59": "minecraft_fence",
            "65,58": "minecraft_fence",
            "60,40": "wall",
            "59,59": "minecraft_fence",
            "53,71": "wall",
            "54,40": "wall",
            "59,56": "minecraft_fence",
            "59,58": "minecraft_fence",
            "59,57": "minecraft_fence",
            "71,50": "minecraft_fence",
            "76,59": "block_of_platinum",
            "71,52": "minecraft_fence",
            "71,51": "minecraft_fence",
            "49,60": "minecraft_fence",
            "60,49": "minecraft_fence",
            "60,48": "minecraft_fence",
            "60,47": "minecraft_fence",
            "60,46": "minecraft_fence",
            "60,45": "minecraft_fence",
            "65,57": "minecraft_fence",
            "65,56": "minecraft_fence",
            "59,60": "minecraft_fence",
            "54,51": "crafting_table",
            "77,59": "block_of_platinum",
            "65,60": "minecraft_fence",
            "49,59": "minecraft_fence",
            "49,58": "minecraft_fence",
            "49,57": "minecraft_fence",
            "49,56": "minecraft_fence",
            "76,71": "wall",
            "59,71": "wall",
            "77,40": "wall",
            "54,65": "trader_103",
            "71,71": "wall",
            "72,40": "wall",
            "48,71": "wall",
            "49,40": "wall",
            "65,71": "wall",
            "48,70": "wall",
            "66,40": "wall"
        },
        "action": "approach_object(self,oak_log,one,trader_104,two)",
        "actionSuccess": false
    },
    "domain": "(define (domain diarcdomaindomain)\n(:requirements :strips :typing :fluents)\n\n(:types\n\tpogoist_102 - pogoist\n\ttwo one - distance\n\toak_log - oak_log\n\tcoord distance property - concept\n\tunlocked - property\n\tactor physobj - physical\n\tphysical concept - var\n\ttrader_104 trader_103 - trader\n\tself thief trader pogoist - actor\n\topen_door oak_log pogo_stick key minecraft_fence diamond_ore plank chest rubber stick block_of_titanium block_of_diamond placeable block_of_platinum diamond crafting_table safe oak_log tree_tap air wall iron_pickaxe breakable door sapling - physobj\n\tcrafting_table plank oak_log sapling tree_tap - placeable\n\tblock_of_platinum diamond_ore plank crafting_table oak_log tree_tap - breakable\n\toak_plank - plank\n\tvar - object\n)\n\n(:predicates\n\n)\n\n(:functions\n\t(totalcost)\n\t(world ?v0)\n\t(inventory ?v0 ?v1)\n\t(container ?v0 ?v1)\n)\n\n(:action deselect\n\t:parameters (?actor - actor ?obj - physobj)\n\n\t:precondition (and\n\t\t(\u003e\u003d( inventory ?actor ?obj ) 1)\n\t\t(holding ?actor ?obj)\n\t)\n\t:effect (and\n\t\t(not(holding ?actor ?obj))\n\t\t(holding ?actor air)\n\t)\n)\n(:action trade_1\n\t:parameters (?actor - actor)\n\n\t:precondition (and\n\t\t(\u003e\u003d( inventory ?actor block_of_platinum ) 1)\n\t\t(facing_obj ?actor trader_103 two)\n\t)\n\t:effect (and\n\t\t(decrease( inventory ?actor block_of_platinum ) 1)\n\t\t(increase( inventory ?actor block_of_titanium ) 1)\n\t)\n)\n(:action place_tree_tap\n\t:parameters (?actor - actor)\n\n\t:precondition (and\n\t\t(facing_obj ?actor log two)\n\t\t(\u003e\u003d( inventory ?actor tree_tap ) 1)\n\t\t(holding ?actor air)\n\t)\n\t:effect (and\n\t\t(increase( world tree_tap ) 1)\n\t\t(not(facing_obj ?actor log two))\n\t\t(facing_obj ?actor tree_tap one)\n\t\t(decrease( inventory ?actor tree_tap ) 1)\n\t\t(next_to tree_tap oak_log)\n\t)\n)\n(:action approach_actor_trader_103_bytwo\n\t:parameters (?actor - actor ?from_obj - physical ?from_dist - distance)\n\n\t:precondition (and\n\t\t(\u003e\u003d( world trader_103 ) 1)\n\t\t(facing_obj ?actor ?from_obj ?from_dist)\n\t)\n\t:effect (and\n\t\t(facing_obj ?actor trader_103 two)\n\t\t(not(facing_obj ?actor ?from_obj ?from_dist))\n\t)\n)\n(:action approach_actor_trader_104_bytwo\n\t:parameters (?actor - actor ?from_obj - physical ?from_dist - distance)\n\n\t:precondition (and\n\t\t(\u003e\u003d( world trader_104 ) 1)\n\t\t(facing_obj ?actor ?from_obj ?from_dist)\n\t)\n\t:effect (and\n\t\t(facing_obj ?actor trader_104 two)\n\t\t(not(facing_obj ?actor ?from_obj ?from_dist))\n\t)\n)\n(:action approach_actor_pogoist_102_bytwo\n\t:parameters (?actor - actor ?from_obj - physical ?from_dist - distance)\n\n\t:precondition (and\n\t\t(\u003e\u003d( world pogoist_102 ) 1)\n\t\t(facing_obj ?actor ?from_obj ?from_dist)\n\t)\n\t:effect (and\n\t\t(facing_obj ?actor pogoist_102 two)\n\t\t(not(facing_obj ?actor ?from_obj ?from_dist))\n\t)\n)\n(:action place_sapling\n\t:parameters (?actor - actor)\n\n\t:precondition (and\n\t\t(facing_obj ?actor air one)\n\t\t(\u003e\u003d( inventory ?actor sapling ) 1)\n\t\t(holding ?actor air)\n\t)\n\t:effect (and\n\t\t(increase( world oak_log ) 1)\n\t\t(decrease( inventory ?actor sapling ) 1)\n\t\t(not(facing_obj ?actor air one))\n\t\t(facing_obj ?actor log one)\n\t)\n)\n(:action break_and_pickup_diamond\n\t:parameters (?actor - actor)\n\n\t:precondition (and\n\t\t(facing_obj ?actor diamond_ore one)\n\t\t(not(floating diamond_ore))\n\t\t(holding ?actor iron_pickaxe)\n\t)\n\t:effect (and\n\t\t(decrease( world diamond_ore ) 1)\n\t\t(not(facing_obj ?actor diamond_ore one))\n\t\t(facing_obj ?actor air one)\n\t\t(increase( inventory ?actor diamond ) 9)\n\t)\n)\n(:action trade_2\n\t:parameters (?actor - actor)\n\n\t:precondition (and\n\t\t(\u003e\u003d( inventory ?actor diamond ) 18)\n\t\t(facing_obj ?actor trader_104 two)\n\t)\n\t:effect (and\n\t\t(decrease( inventory ?actor diamond ) 18)\n\t\t(increase( inventory ?actor block_of_platinum ) 1)\n\t)\n)\n(:action craft_tree_tap\n\t:parameters (?actor - actor)\n\n\t:precondition (and\n\t\t(\u003e\u003d( inventory ?actor plank ) 5)\n\t\t(\u003e\u003d( inventory ?actor stick ) 1)\n\t\t(facing_obj ?actor crafting_table one)\n\t)\n\t:effect (and\n\t\t(increase( inventory ?actor tree_tap ) 1)\n\t\t(decrease( inventory ?actor plank ) 5)\n\t\t(decrease( inventory ?actor stick ) 1)\n\t)\n)\n(:action collect_from_tree_tap\n\t:parameters (?actor - actor)\n\n\t:precondition (and\n\t\t(next_to tree_tap oak_log)\n\t\t(facing_obj ?actor tree_tap one)\n\t)\n\t:effect\n\t\t(increase( inventory ?actor rubber ) 1)\n\n)\n(:action approach_object_oak_log_bytwo\n\t:parameters (?actor - actor ?from_obj - physical ?from_dist - distance)\n\n\t:precondition (and\n\t\t(\u003e\u003d( world oak_log ) 1)\n\t\t(facing_obj ?actor ?from_obj ?from_dist)\n\t)\n\t:effect (and\n\t\t(not(facing_obj ?actor ?from_obj ?from_dist))\n\t\t(facing_obj ?actor log two)\n\t)\n)\n(:action approach_object_oak_log\n\t:parameters (?actor - actor ?from_obj - physical ?from_dist - distance)\n\n\t:precondition (and\n\t\t(\u003e\u003d( world oak_log ) 1)\n\t\t(facing_obj ?actor ?from_obj ?from_dist)\n\t)\n\t:effect (and\n\t\t(not(facing_obj ?actor ?from_obj ?from_dist))\n\t\t(facing_obj ?actor log one)\n\t)\n)\n(:action approach_object_crafting_table\n\t:parameters (?actor - actor ?from_obj - physical ?from_dist - distance)\n\n\t:precondition (and\n\t\t(\u003e\u003d( world crafting_table ) 1)\n\t\t(facing_obj ?actor ?from_obj ?from_dist)\n\t)\n\t:effect (and\n\t\t(not(facing_obj ?actor ?from_obj ?from_dist))\n\t\t(facing_obj ?actor crafting_table one)\n\t)\n)\n(:action approach_object_diamond_ore\n\t:parameters (?actor - actor ?from_obj - physical ?from_dist - distance)\n\n\t:precondition (and\n\t\t(\u003e\u003d( world diamond_ore ) 1)\n\t\t(facing_obj ?actor ?from_obj ?from_dist)\n\t)\n\t:effect (and\n\t\t(not(facing_obj ?actor ?from_obj ?from_dist))\n\t\t(facing_obj ?actor diamond_ore one)\n\t)\n)\n(:action approach_object_door\n\t:parameters (?actor - actor ?from_obj - physical ?from_dist - distance)\n\n\t:precondition (and\n\t\t(\u003e\u003d( world door ) 1)\n\t\t(facing_obj ?actor ?from_obj ?from_dist)\n\t)\n\t:effect (and\n\t\t(not(facing_obj ?actor ?from_obj ?from_dist))\n\t\t(facing_obj ?actor door one)\n\t)\n)\n(:action approach_object_minecraft_fence\n\t:parameters (?actor - actor ?from_obj - physical ?from_dist - distance)\n\n\t:precondition (and\n\t\t(\u003e\u003d( world minecraft_fence ) 1)\n\t\t(facing_obj ?actor ?from_obj ?from_dist)\n\t)\n\t:effect (and\n\t\t(not(facing_obj ?actor ?from_obj ?from_dist))\n\t\t(facing_obj ?actor minecraft_fence one)\n\t)\n)\n(:action approach_object_wall\n\t:parameters (?actor - actor ?from_obj - physical ?from_dist - distance)\n\n\t:precondition (and\n\t\t(\u003e\u003d( world wall ) 1)\n\t\t(facing_obj ?actor ?from_obj ?from_dist)\n\t)\n\t:effect (and\n\t\t(not(facing_obj ?actor ?from_obj ?from_dist))\n\t\t(facing_obj ?actor wall one)\n\t)\n)\n(:action approach_object_block_of_platinum\n\t:parameters (?actor - actor ?from_obj - physical ?from_dist - distance)\n\n\t:precondition (and\n\t\t(\u003e\u003d( world block_of_platinum ) 1)\n\t\t(facing_obj ?actor ?from_obj ?from_dist)\n\t)\n\t:effect (and\n\t\t(not(facing_obj ?actor ?from_obj ?from_dist))\n\t\t(facing_obj ?actor block_of_platinum one)\n\t)\n)\n(:action approach_object_chest\n\t:parameters (?actor - actor ?from_obj - physical ?from_dist - distance)\n\n\t:precondition (and\n\t\t(\u003e\u003d( world chest ) 1)\n\t\t(facing_obj ?actor ?from_obj ?from_dist)\n\t)\n\t:effect (and\n\t\t(not(facing_obj ?actor ?from_obj ?from_dist))\n\t\t(facing_obj ?actor chest one)\n\t)\n)\n(:action break_and_pickup_block_of_platinum\n\t:parameters (?actor - actor)\n\n\t:precondition (and\n\t\t(not(floating block_of_platinum))\n\t\t(facing_obj ?actor block_of_platinum one)\n\t\t(holding ?actor iron_pickaxe)\n\t)\n\t:effect (and\n\t\t(decrease( world block_of_platinum ) 1)\n\t\t(not(facing_obj ?actor block_of_platinum one))\n\t\t(facing_obj ?actor air one)\n\t\t(increase( inventory ?actor block_of_platinum ) 1)\n\t)\n)\n(:action collect_from_safe\n\t:parameters (?actor - actor)\n\n\t:precondition (and\n\t\t(facing_obj ?actor safe one)\n\t\t(propertyOf safe unlocked)\n\t\t(\u003d( container safe diamond ) 18)\n\t)\n\t:effect (and\n\t\t(decrease( container safe diamond ) 18)\n\t\t(increase( inventory ?actor diamond ) 18)\n\t)\n)\n(:action select_iron_pickaxe\n\t:parameters (?actor - actor)\n\n\t:precondition (and\n\t\t(\u003e\u003d( inventory ?actor iron_pickaxe ) 1)\n\t\t(holding ?actor air)\n\t)\n\t:effect (and\n\t\t(not(holding ?actor air))\n\t\t(holding ?actor iron_pickaxe)\n\t)\n)\n(:action select_key\n\t:parameters (?actor - actor)\n\n\t:precondition (and\n\t\t(\u003e\u003d( inventory ?actor key ) 1)\n\t\t(holding ?actor air)\n\t)\n\t:effect (and\n\t\t(not(holding ?actor air))\n\t\t(holding ?actor key)\n\t)\n)\n(:action pickup\n\t:parameters (?actor - actor ?obj - physobj)\n\n\t:precondition (and\n\t\t(facing_obj ?actor ?obj one)\n\t\t(floating ?obj)\n\t)\n\t:effect (and\n\t\t(decrease( world ?obj ) 1)\n\t\t(not(facing_obj ?actor ?obj one))\n\t\t(facing_obj ?actor air one)\n\t\t(increase( inventory ?actor ?obj ) 1)\n\t)\n)\n(:action craft_stick\n\t:parameters (?actor - actor)\n\n\t:precondition\n\t\t(\u003e\u003d( inventory ?actor plank ) 2)\n\n\t:effect (and\n\t\t(increase( inventory ?actor stick ) 4)\n\t\t(decrease( inventory ?actor plank ) 2)\n\t)\n)\n(:action break_and_pickup\n\t:parameters (?actor - actor ?obj - breakable)\n\n\t:precondition (and\n\t\t(not(object ?obj diamond_ore))\n\t\t(not(object ?obj block_of_platinum))\n\t\t(facing_obj ?actor ?obj one)\n\t\t(not(floating ?obj))\n\t)\n\t:effect (and\n\t\t(decrease( world ?obj ) 1)\n\t\t(not(facing_obj ?actor ?obj one))\n\t\t(facing_obj ?actor air one)\n\t\t(increase( inventory ?actor ?obj ) 1)\n\t)\n)\n(:action craft_pogo_stick\n\t:parameters (?actor - actor)\n\n\t:precondition (and\n\t\t(\u003e\u003d( inventory ?actor stick ) 2)\n\t\t(\u003e\u003d( inventory ?actor rubber ) 1)\n\t\t(\u003e\u003d( inventory ?actor block_of_titanium ) 2)\n\t\t(\u003e\u003d( inventory ?actor block_of_diamond ) 2)\n\t\t(facing_obj ?actor crafting_table one)\n\t)\n\t:effect (and\n\t\t(increase( inventory ?actor pogo_stick ) 1)\n\t\t(decrease( inventory ?actor stick ) 2)\n\t\t(decrease( inventory ?actor rubber ) 1)\n\t\t(decrease( inventory ?actor block_of_titanium ) 2)\n\t\t(decrease( inventory ?actor block_of_diamond ) 2)\n\t)\n)\n(:action craft_plank\n\t:parameters (?actor - actor)\n\n\t:precondition\n\t\t(\u003e\u003d( inventory ?actor oak_log ) 1)\n\n\t:effect (and\n\t\t(increase( inventory ?actor oak_plank ) 4)\n\t\t(decrease( inventory ?actor oak_log ) 1)\n\t)\n)\n(:action get_sapling\n\t:parameters (?actor - actor ?facing_obj - physical ?facing_dist - distance)\n\n\t:precondition (and\n\t\t(\u003d( world oak_log ) 0)\n\t\t(facing_obj ?actor ?facing_obj ?facing_dist)\n\t)\n\t:effect (and\n\t\t(not(facing_obj ?actor ?facing_obj ?facing_dist))\n\t\t(facing_obj ?actor air one)\n\t\t(increase( inventory ?actor sapling ) 1)\n\t)\n)\n(:action trade_0\n\t:parameters (?actor - actor)\n\n\t:precondition (and\n\t\t(\u003e\u003d( inventory ?actor block_of_platinum ) 2)\n\t\t(facing_obj ?actor trader_103 two)\n\t)\n\t:effect (and\n\t\t(decrease( inventory ?actor block_of_platinum ) 2)\n\t\t(increase( inventory ?actor diamond ) 9)\n\t)\n)\n(:action trade_3\n\t:parameters (?actor - actor)\n\n\t:precondition (and\n\t\t(\u003e\u003d( inventory ?actor oak_log ) 10)\n\t\t(facing_obj ?actor trader_104 two)\n\t)\n\t:effect (and\n\t\t(decrease( inventory ?actor oak_log ) 10)\n\t\t(increase( inventory ?actor block_of_titanium ) 1)\n\t)\n)\n(:action craft_block_of_diamond\n\t:parameters (?actor - actor)\n\n\t:precondition (and\n\t\t(\u003e\u003d( inventory ?actor diamond ) 9)\n\t\t(facing_obj ?actor crafting_table one)\n\t)\n\t:effect (and\n\t\t(increase( inventory ?actor block_of_diamond ) 1)\n\t\t(decrease( inventory ?actor diamond ) 9)\n\t)\n)\n(:action find_safe\n\t:parameters (?actor - actor ?facing_obj - physical ?facing_dist - distance)\n\n\t:precondition (and\n\t\t(object ?actor self)\n\t\t(\u003d( world safe ) 0)\n\t\t(facing_obj ?actor ?facing_obj ?facing_dist)\n\t\t(holding ?actor air)\n\t\t(\u003e\u003d( inventory ?actor key ) 1)\n\t)\n\t:effect (and\n\t\t(increase( world safe ) 1)\n\t\t(not(facing_obj ?actor ?facing_obj ?facing_dist))\n\t\t(facing_obj ?actor air one)\n\t\t(holding ?actor air)\n\t)\n)\n(:action open_door\n\t:parameters (?actor - actor)\n\n\t:precondition (and\n\t\t(facing_obj ?actor door one)\n\t\t(holding ?actor air)\n\t)\n\t:effect (and\n\t\t(decrease( world door ) 1)\n\t\t(increase( world open_door ) 1)\n\t\t(not(facing_obj ?actor door one))\n\t\t(facing_obj ?actor air one)\n\t)\n)\n(:action use_safe\n\t:parameters (?actor - actor)\n\n\t:precondition (and\n\t\t(facing_obj ?actor safe one)\n\t\t(holding ?actor key)\n\t)\n\t:effect\n\t\t(propertyOf safe unlocked)\n\n)\n(:action collect_from_chest\n\t:parameters (?actor - actor)\n\n\t:precondition (and\n\t\t(facing_obj ?actor chest one)\n\t\t(holding ?actor air)\n\t\t(\u003d( container chest key ) 1)\n\t)\n\t:effect (and\n\t\t(decrease( container chest key ) 1)\n\t\t(increase( inventory ?actor key ) 1)\n\t\t(not(holding ?actor air))\n\t\t(holding ?actor key)\n\t)\n)\n)",
    "plan": "(approach_object self oak_log one trader_104 two)\n(break_and_pickup self oak_log)\n(approach_object self block_of_platinum one air one)\n(select self iron_pickaxe)\n(break_and_pickup_block_of_platinum self block_of_platinum)\n(approach_object self diamond_ore one air one)\n(break_and_pickup_diamond self diamond_ore)\n(approach_actor self trader_103 two air one)\n(deselect self iron_pickaxe)\n(craft_plank self oak_log)\n(approach_object self oak_log one trader_103 two)\n(craft_stick self oak_plank)\n(break_and_pickup self oak_log)\n(approach_object self oak_log two air one)\n(craft_plank self oak_log)\n(approach_object self crafting_table one oak_log two)\n(craft_tree_tap self oak_plank stick)\n(approach_object self oak_log two crafting_table one)\n(place_tree_tap self tree_tap oak_log)\n(collect_from_tree_tap self tree_tap oak_log)\n(approach_actor self trader_103 two tree_tap one)\n(trade_1 self block_of_platinum)\n(approach_object self block_of_platinum one trader_103 two)\n(select self iron_pickaxe)\n(break_and_pickup_block_of_platinum self block_of_platinum)\n(approach_actor self trader_103 two air one)\n(trade_1 self block_of_platinum)\n(approach_object self crafting_table one trader_103 two)\n(craft_block_of_diamond self diamond)\n(approach_object self diamond_ore one crafting_table one)\n(break_and_pickup_diamond self diamond_ore)\n(approach_object self crafting_table one air one)\n(craft_block_of_diamond self diamond)\n(craft_pogo_stick self stick rubber block_of_titanium block_of_diamond)\n",
    "novelActions": []
}